{
  "schema_version": 1,
  "artifact": "content/Knowledge/Outputs/简历追问：低代码工作流引擎 DAG 架构设计.md",
  "artifact_type": "interview_dossier",
  "opportunity_id": null,
  "generated_by": "interview-package",
  "claim_ids": [
    "aiflow.project.scope",
    "aiflow.data-and-backend-boundary",
    "aiflow.telemetry.execution-correlation",
    "aiflow.business-scope",
    "aiflow.engine-core",
    "aiflow.dynamic-branching",
    "aiflow.node-plugin-system",
    "aiflow.variable-editor",
    "aiflow.execution-feedback",
    "aiflow.failure-trace-order",
    "aiflow.reimplementation-boundary",
    "aiflow.result-boundary",
    "aiflow.visual-editor"
  ],
  "status": "current"
}
