{
  "schema_version": 1,
  "artifact": "content/Knowledge/Outputs/指令文件腐化：AGENTS.md 越来越长，Agent 反而变笨了.md",
  "artifact_type": "public_article",
  "opportunity_id": null,
  "generated_by": "career-assets",
  "claim_ids": [
    "evidence-framework.project.scope",
    "evidence-framework.adoption-articles",
    "evidence-framework.agent-skills",
    "evidence-framework.local-quality-gates"
  ],
  "status": "current"
}
