{
  "schema_version": 1,
  "artifact": "content/Knowledge/Outputs/简历回答逐字稿：HATEOAS Agent 友好与权责对等.md",
  "artifact_type": "interview_dossier",
  "opportunity_id": null,
  "generated_by": "interview-package",
  "claim_ids": [
    "hateoas.project.sdk",
    "hateoas.project.model-and-api",
    "hateoas.production-and-public-phases",
    "hateoas.resource-modeling",
    "hateoas.sdk-core",
    "hateoas.cache-invalidation",
    "hateoas.migration-pilot",
    "hateoas.quality",
    "hateoas.public-package-verification",
    "hateoas.production-results",
    "hateoas.backend-boundary",
    "hateoas.type-safety-boundary",
    "hateoas.react-delete-boundary",
    "hateoas.future-boundary",
    "hateoas.adoption-boundary",
    "hateoas.response-formats",
    "hateoas.react-adapter",
    "hateoas.release-pipeline"
  ],
  "status": "current"
}
