{
  "schema_version": 1,
  "artifact": "content/Knowledge/Outputs/职业经历.md",
  "artifact_type": "career_history",
  "opportunity_id": null,
  "generated_by": "career-evidence",
  "claim_ids": [
    "aiflow.business-scope",
    "aiflow.data-and-backend-boundary",
    "aiflow.dynamic-branching",
    "aiflow.engine-core",
    "aiflow.execution-feedback",
    "aiflow.failure-trace-order",
    "aiflow.formula-editor",
    "aiflow.node-plugin-system",
    "aiflow.project.scope",
    "aiflow.reimplementation-boundary",
    "aiflow.result-boundary",
    "aiflow.variable-editor",
    "aiflow.visual-editor",
    "career.capability.ai-determinism",
    "career.capability.association-object-modeling",
    "career.capability.complex-frontend",
    "career.capability.consumption-paths",
    "career.capability.contract-lifecycle",
    "career.capability.progressive-architecture",
    "career.capability.upstream-contracts",
    "career.capability.validation-feedback",
    "career.education.bachelor-computing",
    "career.experience.platform-engineering",
    "career.identity.full-name",
    "career.location.current",
    "career.positioning.full-flow-axis",
    "career.positioning.industry-open",
    "career.positioning.knowledge-engineering-direction",
    "career.positioning.market-title",
    "career.reflection.ai-low-code-transition",
    "career.working-boundary.invasive-backend",
    "domain-modeling.ai-proposal",
    "domain-modeling.frontend-backend-contract",
    "domain-modeling.internal-use",
    "domain-modeling.methodology-recording",
    "domain-modeling.skill-workflow",
    "domain-modeling.discovery-rule-provenance",
    "domain-modeling.downstream-model-review-gate",
    "domain-modeling.mcp-local-sync",
    "domain-modeling.fm-snapshot-export",
    "domain-modeling.mcp-snapshot-access",
    "domain-modeling.local-snapshot-validation",
    "domain-modeling.local-model-publication",
    "domain-modeling.model-driven-delivery",
    "domain-modeling.procurement-case",
    "domain-modeling.project.scope",
    "domain-modeling.validation",
    "figma-ai.agent-orchestration",
    "figma-ai.architecture.dsl",
    "figma-ai.asset-protocol",
    "figma-ai.current-output-boundary",
    "figma-ai.desktop-delivery",
    "figma-ai.editor.features",
    "figma-ai.fig-import-boundary",
    "figma-ai.mcp-bridge",
    "figma-ai.product-frontend-contract",
    "figma-ai.project.scope",
    "figma-ai.reimplementation-scale",
    "figma-ai.run-lifecycle",
    "figma-ai.runtime.boundary",
    "figma-ai.test-execution-boundary",
    "figma-ai.visual-harness",
    "hateoas.adoption-boundary",
    "hateoas.backend-boundary",
    "hateoas.cache-invalidation",
    "hateoas.cache-response-contracts",
    "hateoas.future-boundary",
    "hateoas.incremental-migration-cost-risk",
    "hateoas.migration-pilot",
    "hateoas.production-and-public-phases",
    "hateoas.production-results",
    "hateoas.project.model-and-api",
    "hateoas.project.sdk",
    "hateoas.public-package-verification",
    "hateoas.quality",
    "hateoas.react-adapter",
    "hateoas.react-cache-event-policy",
    "hateoas.react-delete-boundary",
    "hateoas.release-pipeline",
    "hateoas.resource-modeling",
    "hateoas.response-formats",
    "hateoas.sdk-core",
    "hateoas.sdk-independent-consumption",
    "hateoas.state-factory-protocol-adaptation",
    "hateoas.template-driven-business-forms",
    "hateoas.type-safety-boundary",
    "hateoas.workspace-navigation-consumption",
    "hateoas.workspace-navigation-component-tests",
    "hateoas.workflow-write-regression",
    "monitoring-sdk.architecture",
    "monitoring-sdk.collection",
    "monitoring-sdk.downstream-driven-design",
    "monitoring-sdk.platform-boundary",
    "monitoring-sdk.platform-coverage",
    "monitoring-sdk.project.scope",
    "monitoring-sdk.queue-retry",
    "monitoring-sdk.reimplementation-boundary",
    "monitoring-sdk.sourcemap",
    "timeline.shanghai-dingxin",
    "timeline.shanghai-wuwulaike",
    "timeline.shanghai-yixiao"
  ],
  "status": "stale"
}
