{
  "schema_version": 1,
  "artifact": "content/Knowledge/Outputs/从长 PRD 到可控 Context：我的代码仓库 Harness 实践.md",
  "artifact_type": "interview_dossier",
  "opportunity_id": null,
  "generated_by": "interview-package",
  "claim_ids": [
    "company-harness.plan-context-selection",
    "company-harness.instruction-control",
    "company-harness.feedback-compaction",
    "company-harness.qualitative-result",
    "career.capability.validation-feedback",
    "career.capability.ai-determinism",
    "evidence.project.scope",
    "evidence.outer-loop.authority",
    "evidence.human-agent-boundary",
    "evidence.inner-loop.pair",
    "evidence.failure-routing",
    "evidence.showcase-learning-loop",
    "evidence-framework.rewrite-relationship"
  ],
  "status": "current"
}
