{
  "schema_version": 1,
  "artifact": "content/Knowledge/Outputs/简历回答逐字稿：多人实时协同的 AI 辅助领域建模平台.md",
  "artifact_type": "interview_dossier",
  "opportunity_id": null,
  "generated_by": "interview-package",
  "claim_ids": [
    "career.capability.progressive-architecture",
    "domain-modeling.project.scope",
    "domain-modeling.collaboration.direct",
    "domain-modeling.validation",
    "domain-modeling.internal-use",
    "domain-modeling.collaboration-lifecycle",
    "domain-modeling.ai-proposal",
    "domain-modeling.model-driven-delivery",
    "domain-modeling.procurement-case",
    "domain-modeling.team-ai-boundary",
    "domain-modeling.failure-stale-page-resource",
    "domain-modeling.failure-wss-deployment",
    "domain-modeling.collaboration-test-boundary",
    "career.capability.contract-lifecycle",
    "domain-modeling.frontend-backend-contract"
  ],
  "status": "current"
}
