{
  "schema_version": 1,
  "artifact": "content/Knowledge/Outputs/简历追问：渐进式架构与可恢复增强.md",
  "artifact_type": "interview_dossier",
  "opportunity_id": null,
  "generated_by": "interview-package",
  "claim_ids": [
    "career.capability.progressive-architecture",
    "hateoas.project.sdk",
    "hateoas.migration-pilot",
    "hateoas.cache-invalidation",
    "hateoas.quality",
    "aiflow.project.scope",
    "aiflow.engine-core",
    "aiflow.node-plugin-system",
    "aiflow.execution-feedback",
    "aiflow.data-and-backend-boundary",
    "domain-modeling.project.scope",
    "domain-modeling.collaboration.direct",
    "domain-modeling.ai-proposal",
    "domain-modeling.model-driven-delivery",
    "domain-modeling.collaboration-test-boundary",
    "figma-ai.project.scope",
    "figma-ai.architecture.dsl",
    "figma-ai.editor.features",
    "figma-ai.agent-orchestration",
    "figma-ai.visual-harness",
    "figma-ai.run-lifecycle",
    "figma-ai.mcp-bridge",
    "figma-ai.current-output-boundary",
    "monitoring-sdk.project.scope",
    "monitoring-sdk.architecture",
    "monitoring-sdk.queue-retry",
    "monitoring-sdk.platform-boundary",
    "docs-editor.project.scope",
    "docs-editor.core-sdk",
    "docs-editor.collaboration-and-graph",
    "docs-editor.ai-assistant",
    "docs-editor.result-boundary",
    "evidence.project.scope",
    "evidence.outer-loop.authority",
    "evidence.human-agent-boundary",
    "evidence.inner-loop.pair",
    "evidence.failure-routing",
    "evidence.showcase-learning-loop",
    "evidence.model-guidance-boundary",
    "evidence.ci-validation-boundary"
  ],
  "status": "current"
}
