{
  "schema_version": 1,
  "artifact": "content/Knowledge/Outputs/前馈痴迷：Agent 做完就交，从来没人检查.md",
  "artifact_type": "public_article",
  "opportunity_id": null,
  "generated_by": "career-assets",
  "claim_ids": [
    "evidence-framework.project.scope",
    "evidence-framework.adoption-articles",
    "evidence-framework.local-quality-gates",
    "evidence-framework.delivery-loop"
  ],
  "status": "current"
}
