{
  "schema_version": 1,
  "artifact": ".career/opportunities/2026-housesigma-ai-builder/outputs/self-introduction.md",
  "artifact_type": "self_introduction",
  "opportunity_id": "2026-housesigma-ai-builder",
  "generated_by": "resume-package",
  "claim_ids": [
    "career.identity.full-name",
    "career.contact.phone",
    "career.contact.email",
    "career.location.current",
    "career.education.bachelor-computing",
    "career.experience.platform-engineering",
    "career.positioning.market-title",
    "career.positioning.full-flow-axis",
    "career.working-boundary.invasive-backend",
    "career.capability.upstream-contracts",
    "career.capability.complex-frontend",
    "career.capability.validation-feedback",
    "career.capability.ai-determinism",
    "timeline.shanghai-dingxin",
    "timeline.shanghai-yixiao",
    "timeline.shanghai-wuwulaike",
    "domain-modeling.project.scope",
    "domain-modeling.methodology-recording",
    "domain-modeling.frontend-backend-contract",
    "domain-modeling.validation",
    "domain-modeling.internal-use",
    "domain-modeling.model-driven-delivery",
    "domain-modeling.procurement-case",
    "domain-modeling.mcp-local-sync",
    "domain-modeling.local-snapshot-validation",
    "domain-modeling.local-model-publication",
    "domain-modeling.skill-workflow",
    "domain-modeling.fm-incremental-validation",
    "domain-modeling.scope-api-handoff",
    "domain-modeling.api-static-test-vectors",
    "domain-modeling.desktop-file-modeling",
    "domain-modeling.round-end-full-refresh",
    "domain-modeling.generation-model-validation",
    "hateoas.project.sdk",
    "hateoas.sdk-core",
    "hateoas.template-driven-business-forms",
    "hateoas.cache-response-contracts",
    "hateoas.incremental-migration-cost-risk",
    "hateoas.migration-pilot",
    "hateoas.production-results",
    "hateoas.production-and-public-phases",
    "hateoas.adoption-boundary",
    "hateoas.release-pipeline",
    "hateoas.workspace-navigation-component-tests",
    "hateoas.workflow-write-regression",
    "hateoas.public-package-verification",
    "aiflow.project.scope",
    "aiflow.business-scope",
    "aiflow.visual-editor",
    "aiflow.variable-editor",
    "aiflow.formula-editor",
    "aiflow.result-boundary",
    "aiflow.engine-core",
    "aiflow.dynamic-branching",
    "aiflow.node-plugin-system",
    "aiflow.runtime.execution-isolation",
    "aiflow.execution-feedback",
    "aiflow.data-and-backend-boundary",
    "aiflow.sse-server",
    "monitoring-sdk.project.scope",
    "monitoring-sdk.backend-pipeline",
    "monitoring-sdk.response-performance-improvement",
    "monitoring-sdk.downstream-driven-design",
    "monitoring-sdk.architecture",
    "monitoring-sdk.collection",
    "monitoring-sdk.queue-retry",
    "monitoring-sdk.sourcemap",
    "monitoring-sdk.platform-coverage"
  ],
  "status": "current"
}
