{
  "schema_version": 1,
  "artifact": ".career/templates/求职招呼语提示词.md",
  "artifact_type": "greeting_template",
  "opportunity_id": null,
  "generated_by": "resume-package",
  "claim_ids": [
    "aiflow.business-scope",
    "aiflow.data-and-backend-boundary",
    "aiflow.engine-core",
    "aiflow.execution-feedback",
    "aiflow.node-plugin-system",
    "aiflow.project.scope",
    "aiflow.sse-server",
    "aiflow.technical-stack",
    "aiflow.variable-editor",
    "aiflow.visual-editor",
    "career.ai-development.acceptance-checks",
    "career.ai-development.context-assembly",
    "career.ai-development.cross-session-handoff",
    "career.ai-development.evidence-based-delivery",
    "career.ai-development.harness-practice",
    "career.ai-development.modeling-inputs",
    "career.ai-development.pattern-baseline",
    "career.ai-development.single-task-steering",
    "career.capability.complex-frontend",
    "career.capability.consumption-paths",
    "career.capability.upstream-contracts",
    "career.education.bachelor-computing",
    "career.engineering.github-actions-ci",
    "career.engineering.monorepo-nx-pnpm",
    "career.engineering.nx-react-multistage-docker",
    "career.experience.platform-engineering",
    "career.identity.full-name",
    "career.location.current",
    "career.positioning.market-title",
    "domain-modeling.api-static-test-vectors",
    "domain-modeling.company-affiliation",
    "domain-modeling.desktop-file-modeling",
    "domain-modeling.frontend-backend-contract",
    "domain-modeling.generation-model-validation",
    "domain-modeling.internal-use",
    "domain-modeling.methodology-recording",
    "domain-modeling.model-driven-delivery",
    "domain-modeling.model-to-api-mapping",
    "domain-modeling.persistence-and-rule-placement",
    "domain-modeling.project.scope",
    "domain-modeling.round-end-full-refresh",
    "domain-modeling.scenario-acceptance",
    "domain-modeling.scope-api-handoff",
    "domain-modeling.skill-workflow",
    "domain-modeling.technical-stack",
    "domain-modeling.technology-agnostic-portability",
    "hateoas.backend-boundary",
    "hateoas.cache-invalidation",
    "hateoas.incremental-migration-cost-risk",
    "hateoas.project.sdk",
    "hateoas.react-cache-event-policy",
    "hateoas.release-pipeline",
    "hateoas.resource-modeling",
    "hateoas.sdk-core",
    "hateoas.sdk-independent-consumption",
    "hateoas.technical-stack",
    "hateoas.template-driven-business-forms",
    "hateoas.type-safety-boundary",
    "hateoas.workflow-write-regression",
    "hateoas.workspace-navigation-component-tests",
    "hateoas.workspace-navigation-consumption",
    "monitoring-sdk.architecture",
    "monitoring-sdk.backend-pipeline",
    "monitoring-sdk.collection",
    "monitoring-sdk.company-affiliation",
    "monitoring-sdk.platform-boundary",
    "monitoring-sdk.platform-coverage",
    "monitoring-sdk.project.scope",
    "monitoring-sdk.response-performance-improvement",
    "monitoring-sdk.technical-stack",
    "timeline.shanghai-dingxin",
    "timeline.shanghai-wuwulaike",
    "timeline.shanghai-yixiao"
  ],
  "status": "current",
  "artifact_sha256": "ed1a41ec2b3b4b7317907d54fcf07070a50b9578ef7919130dec83ce57f2d6bf",
  "claims_sha256": "548fdfe96d1587c4efa8a60e69606c251fbc0102ac55c0c07ca30645149ea476",
  "source_files": [
    {
      "root": "repo",
      "path": ".agents/skills/resume-package/assets/job-greeting-prompt.md",
      "sha256": "d23bd45a688bf0de0433baed158fbc096b179dfdd6c33bfbe07fdfc1c3730a8e"
    },
    {
      "root": "repo",
      "path": ".career/packages/general-projects-2-5/resume.md",
      "sha256": "3f777f9a5845c433ea9b37a2425d6a3f2bae441523138c9ad1950428b77df8ca"
    },
    {
      "root": "repo",
      "path": "content/Knowledge/Outputs/职业经历.md",
      "sha256": "590b6f46941e5b5ac5ba1aa388c6098736f1efd67e2f4ac856c70c3719c33d95"
    },
    {
      "root": "repo",
      "path": "content/Knowledge/Outputs/自我介绍.md",
      "sha256": "a0798a03afa83b957c5f7c1e59991c7cbad3f181d2a034554d48fbd92b8f7f2d"
    },
    {
      "root": "repo",
      "path": "content/Knowledge/Outputs/项目介绍：AI 原生领域建模与 API 设计平台.md",
      "sha256": "b205a5fd18da02743ea3bbde835c8a6a4da3e2964c2d0ea18207c3714f89d777"
    },
    {
      "root": "repo",
      "path": "content/Knowledge/Outputs/项目介绍：HATEOAS.md",
      "sha256": "d763a8d8b9c003294b390a612b00b0ab893f9ec574ca0c71a9209e33149f91f4"
    },
    {
      "root": "repo",
      "path": "content/Knowledge/Outputs/项目介绍：企业级低代码工作流引擎.md",
      "sha256": "08f61179040290f356c068029d56df28455032a8e711f393ae8a065464ebcb33"
    },
    {
      "root": "repo",
      "path": "content/Knowledge/Outputs/项目介绍：前端埋点与监控 SDK.md",
      "sha256": "3911c1ea323663c747293461906db081a3cf79788783c8458aeaa689fae9ab47"
    },
    {
      "root": "state",
      "path": "manifests/general-projects-2-5-resume.json",
      "sha256": "3f42a321281e0594c5681bb28ca3e8ba18ba208dc27a9c2ee2d36e771c45abf1"
    }
  ],
  "reviewed_at": "2026-10-22T17:07:08+08:00"
}
