{
  "schema_version": 1,
  "artifact": "content/Knowledge/Outputs/反馈过载：Sensors 太多，Agent 不知道哪个信号重要.md",
  "artifact_type": "public_article",
  "opportunity_id": null,
  "generated_by": "career-assets",
  "claim_ids": [
    "evidence-framework.project.scope",
    "evidence-framework.adoption-articles",
    "evidence-framework.local-quality-gates",
    "evidence-framework.delivery-loop"
  ],
  "status": "current"
}
