{
  "schema_version": 1,
  "artifact": "content/Knowledge/Outputs/全栈工程师简历追问地图.md",
  "artifact_type": "interview_dossier",
  "opportunity_id": null,
  "generated_by": "interview-package",
  "claim_ids": [
    "career.experience.platform-engineering",
    "career.positioning.market-title",
    "career.positioning.full-flow-axis",
    "timeline.shanghai-dingxin",
    "timeline.shanghai-yixiao",
    "timeline.shanghai-wuwulaike",
    "career.capability.progressive-architecture",
    "figma-ai.project.scope",
    "figma-ai.runtime.boundary",
    "domain-modeling.project.scope",
    "domain-modeling.collaboration.direct",
    "domain-modeling.validation",
    "hateoas.project.sdk",
    "hateoas.project.model-and-api",
    "aiflow.project.scope",
    "aiflow.data-and-backend-boundary",
    "aiflow.telemetry.execution-correlation",
    "monitoring-sdk.project.scope",
    "monitoring-sdk.platform-boundary",
    "early-frontend.formula-editor",
    "career.positioning.industry-open",
    "career.positioning.knowledge-engineering-direction",
    "career.working-boundary.invasive-backend",
    "career.reflection.ai-low-code-transition",
    "career.capability.complex-frontend",
    "career.capability.upstream-contracts",
    "career.capability.association-object-modeling",
    "career.capability.consumption-paths",
    "career.capability.validation-feedback",
    "career.capability.ai-determinism",
    "figma-ai.architecture.dsl",
    "figma-ai.editor.features",
    "figma-ai.agent-orchestration",
    "figma-ai.visual-harness",
    "figma-ai.run-lifecycle",
    "figma-ai.mcp-bridge",
    "figma-ai.desktop-delivery",
    "figma-ai.fig-import-boundary",
    "figma-ai.current-output-boundary",
    "figma-ai.reimplementation-scale",
    "figma-ai.test-execution-boundary",
    "domain-modeling.internal-use",
    "domain-modeling.collaboration-lifecycle",
    "domain-modeling.ai-proposal",
    "domain-modeling.model-driven-delivery",
    "domain-modeling.procurement-case",
    "domain-modeling.team-ai-boundary",
    "domain-modeling.failure-stale-page-resource",
    "domain-modeling.failure-wss-deployment",
    "domain-modeling.collaboration-test-boundary",
    "hateoas.production-and-public-phases",
    "hateoas.resource-modeling",
    "hateoas.sdk-core",
    "hateoas.cache-invalidation",
    "hateoas.migration-pilot",
    "hateoas.quality",
    "hateoas.public-package-verification",
    "hateoas.production-results",
    "hateoas.backend-boundary",
    "hateoas.type-safety-boundary",
    "hateoas.react-delete-boundary",
    "hateoas.future-boundary",
    "hateoas.adoption-boundary",
    "aiflow.business-scope",
    "aiflow.engine-core",
    "aiflow.dynamic-branching",
    "aiflow.node-plugin-system",
    "aiflow.variable-editor",
    "aiflow.execution-feedback",
    "aiflow.failure-trace-order",
    "aiflow.reimplementation-boundary",
    "aiflow.result-boundary",
    "monitoring-sdk.downstream-driven-design",
    "monitoring-sdk.architecture",
    "monitoring-sdk.collection",
    "monitoring-sdk.queue-retry",
    "monitoring-sdk.sourcemap",
    "monitoring-sdk.platform-coverage",
    "monitoring-sdk.reimplementation-boundary",
    "figma-ai.asset-protocol",
    "hateoas.response-formats",
    "hateoas.react-adapter",
    "hateoas.release-pipeline",
    "aiflow.visual-editor",
    "career.capability.contract-lifecycle",
    "domain-modeling.frontend-backend-contract",
    "figma-ai.product-frontend-contract"
  ],
  "status": "current"
}
