{
  "schema_version": 1,
  "artifact": "content/Knowledge/Outputs/Evidence 项目：项目级与 Agent 级双层循环.md",
  "artifact_type": "interview_dossier",
  "opportunity_id": null,
  "generated_by": "interview-package",
  "claim_ids": [
    "career.capability.progressive-architecture",
    "evidence.project.scope",
    "evidence.outer-loop.authority",
    "evidence.human-agent-boundary",
    "evidence.inner-loop.pair",
    "evidence.failure-routing",
    "evidence.showcase-learning-loop",
    "evidence.model-guidance-boundary",
    "evidence.ci-validation-boundary",
    "career.capability.validation-feedback",
    "career.capability.ai-determinism",
    "career.capability.contract-lifecycle"
  ],
  "status": "current"
}
