{
  "schema_version": 1,
  "artifact": "content/Knowledge/Outputs/隐式约定：规则只存在于人的脑子里.md",
  "artifact_type": "public_article",
  "opportunity_id": null,
  "generated_by": "career-assets",
  "claim_ids": [
    "evidence-framework.project.scope",
    "evidence-framework.adoption-articles",
    "evidence-framework.source-authority-routing",
    "evidence-framework.agent-skills"
  ],
  "status": "current"
}
